{
  "$schema": "https://json-schema.org/draft/2020-12/schema",
  "$id": "https://sinjoh.example/schemas/contracts-v2-release-manifest.json",
  "title": "Sinjoh Contracts v2 Release Manifest",
  "type": "object",
  "additionalProperties": false,
  "required": [
    "chainId",
    "protocolVersion",
    "gitCommit",
    "sourceTreeHash",
    "buildHash",
    "compiler",
    "evmVersion",
    "optimizerEnabled",
    "optimizerRuns",
    "viaIr",
    "broadcaster",
    "protocolFeeRecipient",
    "projectSwapAdapter",
    "projectSwapAdapterRuntimeHash",
    "fundingBandQuoteAsset",
    "fundingBandQuoteAssetRuntimeHash",
    "fundingBandQuoteUsdAggregator",
    "fundingBandQuoteUsdAggregatorRuntimeHash",
    "fundingBandQuoteUsdOracle",
    "fundingBandQuoteUsdOracleRuntimeHash",
    "projectV3PriceGuard500",
    "projectV3PriceGuard500RuntimeHash",
    "projectV3PriceGuard3000",
    "projectV3PriceGuard3000RuntimeHash",
    "projectV3PriceGuard10000",
    "projectV3PriceGuard10000RuntimeHash",
    "swapApprovalLeaf500",
    "swapApprovalProof500",
    "swapApprovalLeaf3000",
    "swapApprovalProof3000",
    "swapApprovalLeaf10000",
    "swapApprovalProof10000",
    "fundingBandIntegrationLeaf",
    "fundingBandIntegrationProof",
    "registry",
    "deploymentEngine",
    "launcher",
    "raffleImplementation",
    "raffleImplementationRuntimeHash",
    "randomnessAdapter",
    "randomnessAdapterRuntimeHash",
    "basketEnabled",
    "basketVaultImplementation",
    "basketVaultImplementationRuntimeHash",
    "erc4626YieldAdapterFactory",
    "erc4626YieldAdapterFactoryRuntimeHash",
    "erc4626YieldAdapterRuntimeHash",
    "fundingBandV3IntegrationFactory",
    "fundingBandV3IntegrationFactoryRuntimeHash",
    "fundingBandMarketCapGuardRuntimeTemplateHash",
    "fundingBandPositionAdapterRuntimeTemplateHash",
    "v3Factory",
    "v3FactoryRuntimeHash",
    "v3PositionManager",
    "v3PositionManagerRuntimeHash",
    "v4PositionManager",
    "v4PositionManagerRuntimeHash",
    "v4StateView",
    "v4StateViewRuntimeHash",
    "permit2",
    "permit2RuntimeHash",
    "tokenCreationCodeHash",
    "multisigCreationCodeHash",
    "timelockCreationCodeHash",
    "stakingCreationCodeHash",
    "treasuryCreationCodeHash",
    "airdropCreationCodeHash",
    "routerCreationCodeHash",
    "basketCreationCodeHash",
    "bandsCreationCodeHash",
    "liquidityCreationCodeHash",
    "integrationApprovalRoot",
    "registryRuntimeHash",
    "deploymentEngineRuntimeHash",
    "launcherRuntimeHash"
  ],
  "properties": {
    "chainId": { "type": "integer", "minimum": 1 },
    "protocolVersion": { "const": 2 },
    "gitCommit": { "$ref": "#/$defs/hash" },
    "sourceTreeHash": { "$ref": "#/$defs/hash" },
    "buildHash": { "$ref": "#/$defs/hash" },
    "compiler": { "const": "solc-0.8.28" },
    "evmVersion": { "const": "cancun" },
    "optimizerEnabled": { "const": true },
    "optimizerRuns": { "const": 200 },
    "viaIr": { "const": true },
    "broadcaster": { "$ref": "#/$defs/address" },
    "protocolFeeRecipient": { "$ref": "#/$defs/address" },
    "projectSwapAdapter": { "$ref": "#/$defs/address" },
    "projectSwapAdapterRuntimeHash": { "$ref": "#/$defs/bytes32" },
    "fundingBandQuoteAsset": { "$ref": "#/$defs/address" },
    "fundingBandQuoteAssetRuntimeHash": { "$ref": "#/$defs/bytes32" },
    "fundingBandQuoteUsdAggregator": { "$ref": "#/$defs/address" },
    "fundingBandQuoteUsdAggregatorRuntimeHash": { "$ref": "#/$defs/bytes32" },
    "fundingBandQuoteUsdOracle": { "$ref": "#/$defs/address" },
    "fundingBandQuoteUsdOracleRuntimeHash": { "$ref": "#/$defs/bytes32" },
    "projectV3PriceGuard500": { "$ref": "#/$defs/address" },
    "projectV3PriceGuard500RuntimeHash": { "$ref": "#/$defs/bytes32" },
    "projectV3PriceGuard3000": { "$ref": "#/$defs/address" },
    "projectV3PriceGuard3000RuntimeHash": { "$ref": "#/$defs/bytes32" },
    "projectV3PriceGuard10000": { "$ref": "#/$defs/address" },
    "projectV3PriceGuard10000RuntimeHash": { "$ref": "#/$defs/bytes32" },
    "swapApprovalLeaf500": { "$ref": "#/$defs/bytes32" },
    "swapApprovalProof500": { "$ref": "#/$defs/proof" },
    "swapApprovalLeaf3000": { "$ref": "#/$defs/bytes32" },
    "swapApprovalProof3000": { "$ref": "#/$defs/proof" },
    "swapApprovalLeaf10000": { "$ref": "#/$defs/bytes32" },
    "swapApprovalProof10000": { "$ref": "#/$defs/proof" },
    "fundingBandIntegrationLeaf": { "$ref": "#/$defs/bytes32" },
    "fundingBandIntegrationProof": { "$ref": "#/$defs/proof" },
    "registry": { "$ref": "#/$defs/address" },
    "deploymentEngine": { "$ref": "#/$defs/address" },
    "launcher": { "$ref": "#/$defs/address" },
    "raffleImplementation": { "$ref": "#/$defs/address" },
    "raffleImplementationRuntimeHash": { "$ref": "#/$defs/bytes32" },
    "randomnessAdapter": { "$ref": "#/$defs/address" },
    "randomnessAdapterRuntimeHash": { "$ref": "#/$defs/bytes32" },
    "basketEnabled": { "const": false },
    "basketVaultImplementation": { "const": "0x0000000000000000000000000000000000000000" },
    "basketVaultImplementationRuntimeHash": { "const": "0x0000000000000000000000000000000000000000000000000000000000000000" },
    "erc4626YieldAdapterFactory": { "const": "0x0000000000000000000000000000000000000000" },
    "erc4626YieldAdapterFactoryRuntimeHash": { "const": "0x0000000000000000000000000000000000000000000000000000000000000000" },
    "erc4626YieldAdapterRuntimeHash": { "const": "0x0000000000000000000000000000000000000000000000000000000000000000" },
    "fundingBandV3IntegrationFactory": { "$ref": "#/$defs/address" },
    "fundingBandV3IntegrationFactoryRuntimeHash": { "$ref": "#/$defs/bytes32" },
    "fundingBandMarketCapGuardRuntimeTemplateHash": { "$ref": "#/$defs/bytes32" },
    "fundingBandPositionAdapterRuntimeTemplateHash": { "$ref": "#/$defs/bytes32" },
    "v3Factory": { "$ref": "#/$defs/address" },
    "v3FactoryRuntimeHash": { "$ref": "#/$defs/bytes32" },
    "v3PositionManager": { "$ref": "#/$defs/address" },
    "v3PositionManagerRuntimeHash": { "$ref": "#/$defs/bytes32" },
    "v4PositionManager": { "$ref": "#/$defs/address" },
    "v4PositionManagerRuntimeHash": { "$ref": "#/$defs/bytes32" },
    "v4StateView": { "$ref": "#/$defs/address" },
    "v4StateViewRuntimeHash": { "$ref": "#/$defs/bytes32" },
    "permit2": { "$ref": "#/$defs/address" },
    "permit2RuntimeHash": { "$ref": "#/$defs/bytes32" },
    "tokenCreationCodeHash": { "$ref": "#/$defs/bytes32" },
    "multisigCreationCodeHash": { "$ref": "#/$defs/bytes32" },
    "timelockCreationCodeHash": { "$ref": "#/$defs/bytes32" },
    "stakingCreationCodeHash": { "$ref": "#/$defs/bytes32" },
    "treasuryCreationCodeHash": { "$ref": "#/$defs/bytes32" },
    "airdropCreationCodeHash": { "$ref": "#/$defs/bytes32" },
    "routerCreationCodeHash": { "$ref": "#/$defs/bytes32" },
    "basketCreationCodeHash": { "const": "0x0000000000000000000000000000000000000000000000000000000000000000" },
    "bandsCreationCodeHash": { "$ref": "#/$defs/bytes32" },
    "liquidityCreationCodeHash": { "$ref": "#/$defs/bytes32" },
    "integrationApprovalRoot": { "$ref": "#/$defs/bytes32" },
    "registryRuntimeHash": { "$ref": "#/$defs/bytes32" },
    "deploymentEngineRuntimeHash": { "$ref": "#/$defs/bytes32" },
    "launcherRuntimeHash": { "$ref": "#/$defs/bytes32" }
  },
  "$defs": {
    "address": { "type": "string", "pattern": "^0x[0-9a-fA-F]{40}$" },
    "bytes32": { "type": "string", "pattern": "^0x[0-9a-fA-F]{64}$" },
    "hash": { "type": "string", "pattern": "^(0x)?[0-9a-fA-F]{40,64}$" },
    "sha256": { "type": "string", "pattern": "^[0-9a-fA-F]{64}$" },
    "proof": {
      "type": "array",
      "minItems": 2,
      "maxItems": 2,
      "items": { "$ref": "#/$defs/bytes32" }
    }
  }
}
