{
  "airdropCreationCodeHash": "0x32355300717294b10445dabec3c6265c4a549c131d0354640aee182ec26c7125",
  "bandsCreationCodeHash": "0xda499488e3e43739c359eabc3ee633df856b4c2eebd04b5c18fe366c08e50ba6",
  "basketCreationCodeHash": "0x0000000000000000000000000000000000000000000000000000000000000000",
  "basketEnabled": false,
  "basketVaultImplementation": "0x0000000000000000000000000000000000000000",
  "basketVaultImplementationRuntimeHash": "0x0000000000000000000000000000000000000000000000000000000000000000",
  "broadcaster": "0x3d58E42d3a920dE4C1F71EE041c7eBb82ee23f49",
  "buildHash": "c2ccda5be9fbc6fcb7907311f48f3f5506782d53d97c4e72f9e56e5aa42d8649",
  "chainId": 4663,
  "compiler": "solc-0.8.28",
  "deploymentEngine": "0x5aa60b74eFC414ABEfAeBa783959afF9fF99dD99",
  "deploymentEngineRuntimeHash": "0xd81561cd73484fb2ff950796f2fb8fdc97c54166ab9dd0df6d1b8c6c0c9b0e39",
  "erc4626YieldAdapterFactory": "0x0000000000000000000000000000000000000000",
  "erc4626YieldAdapterFactoryRuntimeHash": "0x0000000000000000000000000000000000000000000000000000000000000000",
  "erc4626YieldAdapterRuntimeHash": "0x0000000000000000000000000000000000000000000000000000000000000000",
  "evmVersion": "cancun",
  "fundingBandIntegrationLeaf": "0xb261bb6cb5ac15f627f0720929eff12b3174f7685f3f2d069355fa4447c26c3e",
  "fundingBandIntegrationProof": [
    "0x270f007ef7c316351f47c811ef5b04045af533e30d372edfff07d9e00d28d02d",
    "0x371efe7c1f6e1eb78bc28f7d72d0b7a448abf47519b511288217260927020479"
  ],
  "fundingBandMarketCapGuardRuntimeTemplateHash": "0x5f20e3de4d2bc35cb40480360dfe7cbbaf15644bace205e4555e652f929544b6",
  "fundingBandPositionAdapterRuntimeTemplateHash": "0xaaa1ef40661635856a89183d4f32e35218eea1f7696af1e28c487dea77b4d523",
  "fundingBandQuoteAsset": "0x0Bd7D308f8E1639FAb988df18A8011f41EAcAD73",
  "fundingBandQuoteAssetRuntimeHash": "0x5706be52f64875fee65a2cec0d80e47a23d8793cbe85d214b48445e2d05f5353",
  "fundingBandQuoteUsdAggregator": "0x78F3556b67E17Df817D51Ef5a990cDaF09E8d3A9",
  "fundingBandQuoteUsdAggregatorRuntimeHash": "0xbd6f524cdc4268b6bd1bb6f77a8821faeea9c52ee9e0afa0b6d948ce82c966c2",
  "fundingBandQuoteUsdOracle": "0x4a98F742D67f725aB3BD0E427308273354353195",
  "fundingBandQuoteUsdOracleRuntimeHash": "0x6bde18fbfb602edfb4e5554b44ae9fe1f7b2d47ccbe35a7311b0936134a66efd",
  "fundingBandV3IntegrationFactory": "0xdADA6d24c02dc06eEbAcB148F5F95f10C1e1645F",
  "fundingBandV3IntegrationFactoryRuntimeHash": "0x42af7b6fdbaab808c06db8761a7a91578a1e07cc75ce40551b9d6e010c71dcb3",
  "gitCommit": "4ca4f6aca08e7669b1c7e08f21a1219be2cab548",
  "integrationApprovalRoot": "0x88d96153c5e0e6eafaf05e05958ef43773829e556e2a0931280791308e76561a",
  "launcher": "0x9e6Ec5429776aA52d1ec37E0c7c3b145980c8072",
  "launcherRuntimeHash": "0xc106b5ea982d60ebc79fc3e99dd12f9faad18d39e491f8ca32972be2dd780778",
  "liquidityCreationCodeHash": "0x24e2ed7d842b1d0e442ab3b3f5cff6ff5582d5c4927a74717acce670665534c9",
  "multisigCreationCodeHash": "0x4c71df03fefb127c067368034f9f390363fb46c42b5d0ebbbfb85345f95249a1",
  "optimizerEnabled": true,
  "optimizerRuns": 200,
  "permit2": "0x000000000022D473030F116dDEE9F6B43aC78BA3",
  "permit2RuntimeHash": "0x5208783f52488f7d3493e5e38311ab707c1d75457fe472a19b0b4d57d66a7fca",
  "projectSwapAdapter": "0xc9F600ebaf9EE1F4a24568D2e4Af9E8df1e07D7B",
  "projectSwapAdapterRuntimeHash": "0x17b8eecc60ff9af5768240b0384e96c4e54fd8611355297e45146303294c6ac6",
  "projectV3PriceGuard10000": "0x425060E1edfcB3d7B3CEb0BEdECc20A771081AC3",
  "projectV3PriceGuard10000RuntimeHash": "0x6ad1162bbc16e7298069e52ae6d2313aabf751733f92c1e833e3ce8a54bcbd63",
  "projectV3PriceGuard3000": "0xE46485a5A9BA6CFe5d5c5d37049460ebFDF50d13",
  "projectV3PriceGuard3000RuntimeHash": "0x0ccd2e844de8f5ee2dccdeca6140189a3e75c791a2a9d1969976f1447b495872",
  "projectV3PriceGuard500": "0x8a5516Fbe589Ea4d4E9a69e39Cae307b109b5842",
  "projectV3PriceGuard500RuntimeHash": "0xa1eb83fbcd5959e18a125614d807969eae7cde0c718670e5aaecbe089797be4f",
  "protocolFeeRecipient": "0x5Bb7582557F5be30b62c335Ad3ccf4bA79E138c5",
  "protocolVersion": 2,
  "raffleImplementation": "0xf2B8d3B1bF78223e435063BF347a7c57211c7fd4",
  "raffleImplementationRuntimeHash": "0xba22d4e2aa622933541cb231f6ab8eca670539c748c8507e21742125157a0010",
  "randomnessAdapter": "0xD16BCD59ca33C1e85578Aa5d60a02C4E2231c491",
  "randomnessAdapterRuntimeHash": "0x72ce584dc295ce6e9bfb87803e2445c44a79ced3e5461d894d5028c13f9f5d0b",
  "registry": "0xb5e082e6Bb54f007a0b1Aa7534e6e9855490A473",
  "registryRuntimeHash": "0xa0ccc5c5c1d8ca873a3a84bcc13073f027f99976c414dabe0d97997744104f4d",
  "routerCreationCodeHash": "0xf076d2f4e83c8b0eb3960d99d6cb57aab4ab066373fa2fbd562d7259da09bf8b",
  "sourceTreeHash": "1674118a760a5211f07890e8b3f6ce90c96daab3",
  "stakingCreationCodeHash": "0x79c3967294162f08fdce1eaf4f6a273704579d895614ebe5dc7c9ee4fe11054f",
  "swapApprovalLeaf10000": "0x270f007ef7c316351f47c811ef5b04045af533e30d372edfff07d9e00d28d02d",
  "swapApprovalLeaf3000": "0x5b2c8532d85dbf2f45253120ce910eb686f96b45423310721ef91ee9d593c4d7",
  "swapApprovalLeaf500": "0x1e654108396a4181c80f03ebf57106f0c92154316dd5edfcbf3972ba7f1187f4",
  "swapApprovalProof10000": [
    "0xb261bb6cb5ac15f627f0720929eff12b3174f7685f3f2d069355fa4447c26c3e",
    "0x371efe7c1f6e1eb78bc28f7d72d0b7a448abf47519b511288217260927020479"
  ],
  "swapApprovalProof3000": [
    "0x1e654108396a4181c80f03ebf57106f0c92154316dd5edfcbf3972ba7f1187f4",
    "0xcaefe3c1b3533d3a6cc25ac4e78a09f28a870cf095bcde527b1d870b71e815a0"
  ],
  "swapApprovalProof500": [
    "0x5b2c8532d85dbf2f45253120ce910eb686f96b45423310721ef91ee9d593c4d7",
    "0xcaefe3c1b3533d3a6cc25ac4e78a09f28a870cf095bcde527b1d870b71e815a0"
  ],
  "timelockCreationCodeHash": "0x53e86f8e61920dde59038d3737ec2a3035d7556b759ead15a36dc8099566ccfa",
  "tokenCreationCodeHash": "0xedc6119a55da579b0bdd8e02a0ebb1834c9c67cfb9c980e9028201bbb03cbc8d",
  "treasuryCreationCodeHash": "0xc2ddadd18144302b9f44cbe6ed9fd95fff314813dc8f5f2f2f2ef4675af8a467",
  "v3Factory": "0x1f7d7550B1b028f7571E69A784071F0205FD2EfA",
  "v3FactoryRuntimeHash": "0xec72b1abd1f2faee020cfea9c646bd8994f9fb389054f6e574f103a895091739",
  "v3PositionManager": "0x73991a25C818Bf1f1128dEAaB1492D45638DE0D3",
  "v3PositionManagerRuntimeHash": "0x0a493d1af3d0f25fed8efa205244ebee14114267a08647fc38c515c7cd6ead4f",
  "v4PositionManager": "0x58daec3116aae6D93017bAAea7749052E8a04fA7",
  "v4PositionManagerRuntimeHash": "0xc873e135dc9aaec88489cfbad146b4cb49d6a32e0d80326377784b7ba17670b2",
  "v4StateView": "0xF3334192D15450CdD385c8B70e03f9A6bD9E673b",
  "v4StateViewRuntimeHash": "0x7d9c591e0956fd89d98feb4ffcfe8bf1f7a62bd485edd979fa21d104b49878a6",
  "viaIr": true
}