{
  "airdropCreationCodeHash": "0x32355300717294b10445dabec3c6265c4a549c131d0354640aee182ec26c7125",
  "bandsCreationCodeHash": "0x8c86d1138644eeeafb5e9e836d92b306737746303d7c789fba9d290984f01a38",
  "basketCreationCodeHash": "0x0000000000000000000000000000000000000000000000000000000000000000",
  "basketEnabled": false,
  "basketVaultImplementation": "0x0000000000000000000000000000000000000000",
  "basketVaultImplementationRuntimeHash": "0x0000000000000000000000000000000000000000000000000000000000000000",
  "broadcaster": "0x3d58E42d3a920dE4C1F71EE041c7eBb82ee23f49",
  "buildHash": "ab178fe06e0ed810ba03968fdede0a5a247001c6b4ca09545dfd194927a49fbe",
  "chainId": 4663,
  "compiler": "solc-0.8.28",
  "deploymentEngine": "0x62e2bb69C72c3baa72ddf9CeD4AdfC664Fa10dFa",
  "deploymentEngineRuntimeHash": "0xdc8db2c6c2cae04a410ce9d925f74e04e336f134871e376aaa56dc9e62b44d3d",
  "erc4626YieldAdapterFactory": "0x0000000000000000000000000000000000000000",
  "erc4626YieldAdapterFactoryRuntimeHash": "0x0000000000000000000000000000000000000000000000000000000000000000",
  "erc4626YieldAdapterRuntimeHash": "0x0000000000000000000000000000000000000000000000000000000000000000",
  "evmVersion": "cancun",
  "fundingBandIntegrationLeaf": "0x772d9c6461c748a11145be0a3b6084376063764c1d3fab2e703030d464adcf05",
  "fundingBandIntegrationProof": [
    "0x86db1f56c4257fa1112ffefb74c74fa6fbabf7403adfffa4d785464d38fcbec8",
    "0xe9ef81653a0ae4428f0135ea310f3b3d5ff31410d9497f8307625cb9623a8333"
  ],
  "fundingBandMarketCapGuardRuntimeTemplateHash": "0x5f20e3de4d2bc35cb40480360dfe7cbbaf15644bace205e4555e652f929544b6",
  "fundingBandPositionAdapterRuntimeTemplateHash": "0xaaa1ef40661635856a89183d4f32e35218eea1f7696af1e28c487dea77b4d523",
  "fundingBandQuoteAsset": "0x0Bd7D308f8E1639FAb988df18A8011f41EAcAD73",
  "fundingBandQuoteAssetRuntimeHash": "0x5706be52f64875fee65a2cec0d80e47a23d8793cbe85d214b48445e2d05f5353",
  "fundingBandQuoteUsdAggregator": "0x09978409A32B7a8F574D2858c9981456E63CC65E",
  "fundingBandQuoteUsdAggregatorRuntimeHash": "0x0f34766397d79c63a443067d266f6cddce1107ad410fc75f68293c0386412bb7",
  "fundingBandQuoteUsdOracle": "0x14F6EBa91724c4Fd9c0bc22D5412502Eb3CC4F9B",
  "fundingBandQuoteUsdOracleRuntimeHash": "0x205698f5fa62567c1b9c6059a868f28a2e408c004c8d9815e60f4d42d2b9560e",
  "fundingBandV3IntegrationFactory": "0x134eC02Da40362dAF332a9B9c6B6BDae90Aa1405",
  "fundingBandV3IntegrationFactoryRuntimeHash": "0x42af7b6fdbaab808c06db8761a7a91578a1e07cc75ce40551b9d6e010c71dcb3",
  "gitCommit": "ddec345432e464bf87e8ab4f463132c67282cdca",
  "integrationApprovalRoot": "0x9a03a1c049ba2dd72a17444751c29c37c19ced9c2a8952aefabbed935264dd5f",
  "launcher": "0x4536Eb881C2A9D841562e622660F949b45117AFB",
  "launcherRuntimeHash": "0x95e1d0606be4de8e06575d5fc0ce1dc6e382bc9b727f27b33b16ebfe32487e24",
  "liquidityCreationCodeHash": "0x24e2ed7d842b1d0e442ab3b3f5cff6ff5582d5c4927a74717acce670665534c9",
  "multisigCreationCodeHash": "0x4c71df03fefb127c067368034f9f390363fb46c42b5d0ebbbfb85345f95249a1",
  "optimizerEnabled": true,
  "optimizerRuns": 200,
  "permit2": "0x000000000022D473030F116dDEE9F6B43aC78BA3",
  "permit2RuntimeHash": "0x5208783f52488f7d3493e5e38311ab707c1d75457fe472a19b0b4d57d66a7fca",
  "projectSwapAdapter": "0xc9F600ebaf9EE1F4a24568D2e4Af9E8df1e07D7B",
  "projectSwapAdapterRuntimeHash": "0x17b8eecc60ff9af5768240b0384e96c4e54fd8611355297e45146303294c6ac6",
  "projectV3PriceGuard10000": "0xE1fc5EBeb1Ff1062074DB6b9413BA8739dE59b44",
  "projectV3PriceGuard10000RuntimeHash": "0x6ad1162bbc16e7298069e52ae6d2313aabf751733f92c1e833e3ce8a54bcbd63",
  "projectV3PriceGuard3000": "0xe5e0Fe035031651659d755793701AD41944b3AF2",
  "projectV3PriceGuard3000RuntimeHash": "0x0ccd2e844de8f5ee2dccdeca6140189a3e75c791a2a9d1969976f1447b495872",
  "projectV3PriceGuard500": "0x4cfe313d27Cb8A951381Cb18d8e53FC3d431bAcA",
  "projectV3PriceGuard500RuntimeHash": "0xa1eb83fbcd5959e18a125614d807969eae7cde0c718670e5aaecbe089797be4f",
  "protocolFeeRecipient": "0x5Bb7582557F5be30b62c335Ad3ccf4bA79E138c5",
  "protocolVersion": 2,
  "raffleImplementation": "0x333358b15dEB6c0a23Ad7AE50A2c890EBa15e035",
  "raffleImplementationRuntimeHash": "0xba22d4e2aa622933541cb231f6ab8eca670539c748c8507e21742125157a0010",
  "randomnessAdapter": "0xD16BCD59ca33C1e85578Aa5d60a02C4E2231c491",
  "randomnessAdapterRuntimeHash": "0x72ce584dc295ce6e9bfb87803e2445c44a79ced3e5461d894d5028c13f9f5d0b",
  "registry": "0x608f4951AE73976EcEfB15a409B72d84e367F340",
  "registryRuntimeHash": "0x1acba80386751647f010d4e227746ddc8f61ed12112de17d43252e6598e1142d",
  "routerCreationCodeHash": "0xf076d2f4e83c8b0eb3960d99d6cb57aab4ab066373fa2fbd562d7259da09bf8b",
  "sourceTreeHash": "fe339a22399207aa9a6b1b98af686a0a63440cea",
  "stakingCreationCodeHash": "0x79c3967294162f08fdce1eaf4f6a273704579d895614ebe5dc7c9ee4fe11054f",
  "swapApprovalLeaf10000": "0x86db1f56c4257fa1112ffefb74c74fa6fbabf7403adfffa4d785464d38fcbec8",
  "swapApprovalLeaf3000": "0xfddf2ffce63fefc221cf7be16d7e58228e89d6c76b5e113863a3bebd5a919754",
  "swapApprovalLeaf500": "0xe29ffffc6e4a1f8665ffdebbf5808ab03e8beccc50c9de755df1ce3caead4137",
  "swapApprovalProof10000": [
    "0x772d9c6461c748a11145be0a3b6084376063764c1d3fab2e703030d464adcf05",
    "0xe9ef81653a0ae4428f0135ea310f3b3d5ff31410d9497f8307625cb9623a8333"
  ],
  "swapApprovalProof3000": [
    "0xe29ffffc6e4a1f8665ffdebbf5808ab03e8beccc50c9de755df1ce3caead4137",
    "0x0d73afa062b0485520f796577bdde9fc4cb0ff13bf1803ba01b970fc61f6ae9f"
  ],
  "swapApprovalProof500": [
    "0xfddf2ffce63fefc221cf7be16d7e58228e89d6c76b5e113863a3bebd5a919754",
    "0x0d73afa062b0485520f796577bdde9fc4cb0ff13bf1803ba01b970fc61f6ae9f"
  ],
  "timelockCreationCodeHash": "0x53e86f8e61920dde59038d3737ec2a3035d7556b759ead15a36dc8099566ccfa",
  "tokenCreationCodeHash": "0xedc6119a55da579b0bdd8e02a0ebb1834c9c67cfb9c980e9028201bbb03cbc8d",
  "treasuryCreationCodeHash": "0xc2ddadd18144302b9f44cbe6ed9fd95fff314813dc8f5f2f2f2ef4675af8a467",
  "v3Factory": "0x1f7d7550B1b028f7571E69A784071F0205FD2EfA",
  "v3FactoryRuntimeHash": "0xec72b1abd1f2faee020cfea9c646bd8994f9fb389054f6e574f103a895091739",
  "v3PositionManager": "0x73991a25C818Bf1f1128dEAaB1492D45638DE0D3",
  "v3PositionManagerRuntimeHash": "0x0a493d1af3d0f25fed8efa205244ebee14114267a08647fc38c515c7cd6ead4f",
  "v4PositionManager": "0x58daec3116aae6D93017bAAea7749052E8a04fA7",
  "v4PositionManagerRuntimeHash": "0xc873e135dc9aaec88489cfbad146b4cb49d6a32e0d80326377784b7ba17670b2",
  "v4StateView": "0xF3334192D15450CdD385c8B70e03f9A6bD9E673b",
  "v4StateViewRuntimeHash": "0x7d9c591e0956fd89d98feb4ffcfe8bf1f7a62bd485edd979fa21d104b49878a6",
  "viaIr": true
}