{
  "airdropCreationCodeHash": "0x32355300717294b10445dabec3c6265c4a549c131d0354640aee182ec26c7125",
  "bandsCreationCodeHash": "0x8c86d1138644eeeafb5e9e836d92b306737746303d7c789fba9d290984f01a38",
  "basketCreationCodeHash": "0x0000000000000000000000000000000000000000000000000000000000000000",
  "basketEnabled": false,
  "basketVaultImplementation": "0x0000000000000000000000000000000000000000",
  "basketVaultImplementationRuntimeHash": "0x0000000000000000000000000000000000000000000000000000000000000000",
  "broadcaster": "0x3d58E42d3a920dE4C1F71EE041c7eBb82ee23f49",
  "buildHash": "ab178fe06e0ed810ba03968fdede0a5a247001c6b4ca09545dfd194927a49fbe",
  "chainId": 4663,
  "compiler": "solc-0.8.28",
  "deploymentEngine": "0xa6990b81Ea94ff9e209F0F99d988c260e10dFF9a",
  "deploymentEngineRuntimeHash": "0x096203d781ae7fb690cb20bdf838ceee9f1392e7f0c4b47d504c42266277bf5b",
  "erc4626YieldAdapterFactory": "0x0000000000000000000000000000000000000000",
  "erc4626YieldAdapterFactoryRuntimeHash": "0x0000000000000000000000000000000000000000000000000000000000000000",
  "erc4626YieldAdapterRuntimeHash": "0x0000000000000000000000000000000000000000000000000000000000000000",
  "evmVersion": "cancun",
  "fundingBandIntegrationLeaf": "0x852b6599d648ed36dac89149df46d52e8075e7c01344f99123c2e06f2fd48950",
  "fundingBandIntegrationProof": [
    "0x27736176f473e245af021e368cd04b5b7965c49d2624447cd0e3e76f6cda0e67",
    "0xbc933cbe7d7e168d80f7d942d9f31a1874f83cb62a0876aab6ee79c1630e91bc"
  ],
  "fundingBandMarketCapGuardRuntimeTemplateHash": "0x5f20e3de4d2bc35cb40480360dfe7cbbaf15644bace205e4555e652f929544b6",
  "fundingBandPositionAdapterRuntimeTemplateHash": "0xaaa1ef40661635856a89183d4f32e35218eea1f7696af1e28c487dea77b4d523",
  "fundingBandQuoteAsset": "0x0Bd7D308f8E1639FAb988df18A8011f41EAcAD73",
  "fundingBandQuoteAssetRuntimeHash": "0x5706be52f64875fee65a2cec0d80e47a23d8793cbe85d214b48445e2d05f5353",
  "fundingBandQuoteUsdAggregator": "0x78F3556b67E17Df817D51Ef5a990cDaF09E8d3A9",
  "fundingBandQuoteUsdAggregatorRuntimeHash": "0xbd6f524cdc4268b6bd1bb6f77a8821faeea9c52ee9e0afa0b6d948ce82c966c2",
  "fundingBandQuoteUsdOracle": "0xd0458b56d9A9557df6A73E5340d9FFccED9c4CE2",
  "fundingBandQuoteUsdOracleRuntimeHash": "0x6bde18fbfb602edfb4e5554b44ae9fe1f7b2d47ccbe35a7311b0936134a66efd",
  "fundingBandV3IntegrationFactory": "0xc711C84b7966CEc718DAB694A8127DaA1c2A3DE0",
  "fundingBandV3IntegrationFactoryRuntimeHash": "0x42af7b6fdbaab808c06db8761a7a91578a1e07cc75ce40551b9d6e010c71dcb3",
  "gitCommit": "08679352491763289fa9507c44d2b40e0a381844",
  "integrationApprovalRoot": "0x8a2bc95e7c4fdadae31a44d90e7dec61ec84103569341c58fa3b1a41fe773b22",
  "launcher": "0x42921684FC82077cF49f73C7daFD5F3ca7949d79",
  "launcherRuntimeHash": "0x153d5534433ba92761002db30c3a67cde525d7bef6bfe43544dc4cb47f73b47c",
  "liquidityCreationCodeHash": "0x24e2ed7d842b1d0e442ab3b3f5cff6ff5582d5c4927a74717acce670665534c9",
  "multisigCreationCodeHash": "0x4c71df03fefb127c067368034f9f390363fb46c42b5d0ebbbfb85345f95249a1",
  "optimizerEnabled": true,
  "optimizerRuns": 200,
  "permit2": "0x000000000022D473030F116dDEE9F6B43aC78BA3",
  "permit2RuntimeHash": "0x5208783f52488f7d3493e5e38311ab707c1d75457fe472a19b0b4d57d66a7fca",
  "projectSwapAdapter": "0xc9F600ebaf9EE1F4a24568D2e4Af9E8df1e07D7B",
  "projectSwapAdapterRuntimeHash": "0x17b8eecc60ff9af5768240b0384e96c4e54fd8611355297e45146303294c6ac6",
  "projectV3PriceGuard10000": "0x4e7e1651A025053d74561485A45cf5A8DAEe4d11",
  "projectV3PriceGuard10000RuntimeHash": "0x6ad1162bbc16e7298069e52ae6d2313aabf751733f92c1e833e3ce8a54bcbd63",
  "projectV3PriceGuard3000": "0xca0504D06673BF71069d3E00dD534cB8290accDA",
  "projectV3PriceGuard3000RuntimeHash": "0x0ccd2e844de8f5ee2dccdeca6140189a3e75c791a2a9d1969976f1447b495872",
  "projectV3PriceGuard500": "0xCFeDB3dD27770c55b7aAC95c2218E2DeA65844dF",
  "projectV3PriceGuard500RuntimeHash": "0xa1eb83fbcd5959e18a125614d807969eae7cde0c718670e5aaecbe089797be4f",
  "protocolFeeRecipient": "0x5Bb7582557F5be30b62c335Ad3ccf4bA79E138c5",
  "protocolVersion": 2,
  "raffleImplementation": "0x7161B292Ddd8c644Cd535D6C7d9a213751bb6778",
  "raffleImplementationRuntimeHash": "0xba22d4e2aa622933541cb231f6ab8eca670539c748c8507e21742125157a0010",
  "randomnessAdapter": "0xD16BCD59ca33C1e85578Aa5d60a02C4E2231c491",
  "randomnessAdapterRuntimeHash": "0x72ce584dc295ce6e9bfb87803e2445c44a79ced3e5461d894d5028c13f9f5d0b",
  "registry": "0xc6eDD9Dbfc996eE86B1fBd72B589D7DfBd6EeDBD",
  "registryRuntimeHash": "0x02c50998fc1ee2bae540d38fecfc947d6fdc0cda2271f871b2fc0988d7404ca7",
  "routerCreationCodeHash": "0xf076d2f4e83c8b0eb3960d99d6cb57aab4ab066373fa2fbd562d7259da09bf8b",
  "sourceTreeHash": "220bff1f270bab07451ddc7cf6b2194e451cbf81",
  "stakingCreationCodeHash": "0x79c3967294162f08fdce1eaf4f6a273704579d895614ebe5dc7c9ee4fe11054f",
  "swapApprovalLeaf10000": "0x27736176f473e245af021e368cd04b5b7965c49d2624447cd0e3e76f6cda0e67",
  "swapApprovalLeaf3000": "0x1ba0a3459545b5ebda5ec2b521ebc8893133d073c3cc688ddf07dff7ab262839",
  "swapApprovalLeaf500": "0xb929ab2d432a4953ab7b3e1121284c52112a71a769a2028b25a00848b1b14981",
  "swapApprovalProof10000": [
    "0x852b6599d648ed36dac89149df46d52e8075e7c01344f99123c2e06f2fd48950",
    "0xbc933cbe7d7e168d80f7d942d9f31a1874f83cb62a0876aab6ee79c1630e91bc"
  ],
  "swapApprovalProof3000": [
    "0xb929ab2d432a4953ab7b3e1121284c52112a71a769a2028b25a00848b1b14981",
    "0x8d47a5e3402439337fe592260a791f79ec1d606209a41b80031e2343a21592a5"
  ],
  "swapApprovalProof500": [
    "0x1ba0a3459545b5ebda5ec2b521ebc8893133d073c3cc688ddf07dff7ab262839",
    "0x8d47a5e3402439337fe592260a791f79ec1d606209a41b80031e2343a21592a5"
  ],
  "timelockCreationCodeHash": "0x53e86f8e61920dde59038d3737ec2a3035d7556b759ead15a36dc8099566ccfa",
  "tokenCreationCodeHash": "0xedc6119a55da579b0bdd8e02a0ebb1834c9c67cfb9c980e9028201bbb03cbc8d",
  "treasuryCreationCodeHash": "0xc2ddadd18144302b9f44cbe6ed9fd95fff314813dc8f5f2f2f2ef4675af8a467",
  "v3Factory": "0x1f7d7550B1b028f7571E69A784071F0205FD2EfA",
  "v3FactoryRuntimeHash": "0xec72b1abd1f2faee020cfea9c646bd8994f9fb389054f6e574f103a895091739",
  "v3PositionManager": "0x73991a25C818Bf1f1128dEAaB1492D45638DE0D3",
  "v3PositionManagerRuntimeHash": "0x0a493d1af3d0f25fed8efa205244ebee14114267a08647fc38c515c7cd6ead4f",
  "v4PositionManager": "0x58daec3116aae6D93017bAAea7749052E8a04fA7",
  "v4PositionManagerRuntimeHash": "0xc873e135dc9aaec88489cfbad146b4cb49d6a32e0d80326377784b7ba17670b2",
  "v4StateView": "0xF3334192D15450CdD385c8B70e03f9A6bD9E673b",
  "v4StateViewRuntimeHash": "0x7d9c591e0956fd89d98feb4ffcfe8bf1f7a62bd485edd979fa21d104b49878a6",
  "viaIr": true
}